[
  {
    "id": "aff_selflove_001",
    "locale": "en-GB",
    "text": "I deserve kindness, especially from myself.",
    "tone": "GENTLE",
    "intensity": "LOW",
    "absolute": false,
    "sensitiveTopic": false,
    "categoryIds": [
      "cat_self_love"
    ],
    "tags": [
      "self_compassion",
      "kindness"
    ],
    "contraindications": [],
    "readingLevel": 6,
    "isPremium": false,
    "source": "CURATED",
    "createdAt": "2026-02-17T12:00:00Z",
    "updatedAt": "2026-02-17T12:00:00Z"
  },
  {
    "id": "aff_selflove_002",
    "locale": "en-GB",
    "text": "I can speak to myself like I would to a friend.",
    "tone": "GENTLE",
    "intensity": "LOW",
    "absolute": false,
    "sensitiveTopic": false,
    "categoryIds": [
      "cat_self_love"
    ],
    "tags": [
      "self_compassion",
      "mindfulness"
    ],
    "contraindications": [],
    "readingLevel": 6,
    "isPremium": false,
    "source": "CURATED",
    "createdAt": "2026-02-17T12:00:00Z",
    "updatedAt": "2026-02-17T12:00:00Z"
  },
  {
    "id": "aff_selflove_003",
    "locale": "en-GB",
    "text": "I am allowed to rest without earning it.",
    "tone": "GENTLE",
    "intensity": "MEDIUM",
    "absolute": false,
    "sensitiveTopic": false,
    "categoryIds": [
      "cat_self_love",
      "cat_resilience"
    ],
    "tags": [
      "rest",
      "boundaries"
    ],
    "contraindications": [],
    "readingLevel": 6,
    "isPremium": false,
    "source": "CURATED",
    "createdAt": "2026-02-17T12:00:00Z",
    "updatedAt": "2026-02-17T12:00:00Z"
  },
  {
    "id": "aff_conf_001",
    "locale": "en-GB",
    "text": "I can do hard things in small steps.",
    "tone": "GENTLE",
    "intensity": "MEDIUM",
    "absolute": false,
    "sensitiveTopic": false,
    "categoryIds": [
      "cat_confidence",
      "cat_resilience"
    ],
    "tags": [
      "growth",
      "agency"
    ],
    "contraindications": [],
    "readingLevel": 6,
    "isPremium": false,
    "source": "CURATED",
    "createdAt": "2026-02-17T12:00:00Z",
    "updatedAt": "2026-02-17T12:00:00Z"
  },
  {
    "id": "aff_conf_002",
    "locale": "en-GB",
    "text": "I am learning as I go, and that is enough.",
    "tone": "GENTLE",
    "intensity": "LOW",
    "absolute": false,
    "sensitiveTopic": false,
    "categoryIds": [
      "cat_confidence",
      "cat_self_love"
    ],
    "tags": [
      "growth",
      "self_trust"
    ],
    "contraindications": [],
    "readingLevel": 6,
    "isPremium": false,
    "source": "CURATED",
    "createdAt": "2026-02-17T12:00:00Z",
    "updatedAt": "2026-02-17T12:00:00Z"
  },
  {
    "id": "aff_conf_003",
    "locale": "en-GB",
    "text": "I can try again with more information.",
    "tone": "GENTLE",
    "intensity": "LOW",
    "absolute": false,
    "sensitiveTopic": false,
    "categoryIds": [
      "cat_confidence",
      "cat_focus"
    ],
    "tags": [
      "growth",
      "work"
    ],
    "contraindications": [],
    "readingLevel": 6,
    "isPremium": true,
    "source": "CURATED",
    "createdAt": "2026-02-17T12:00:00Z",
    "updatedAt": "2026-02-17T12:00:00Z"
  },
  {
    "id": "aff_calm_001",
    "locale": "en-GB",
    "text": "I can take one slow breath right now.",
    "tone": "GENTLE",
    "intensity": "LOW",
    "absolute": false,
    "sensitiveTopic": false,
    "categoryIds": [
      "cat_calm"
    ],
    "tags": [
      "breath",
      "mindfulness"
    ],
    "contraindications": [],
    "readingLevel": 6,
    "isPremium": false,
    "source": "CURATED",
    "createdAt": "2026-02-17T12:00:00Z",
    "updatedAt": "2026-02-17T12:00:00Z"
  },
  {
    "id": "aff_calm_002",
    "locale": "en-GB",
    "text": "This feeling is uncomfortable, not dangerous.",
    "tone": "GENTLE",
    "intensity": "MEDIUM",
    "absolute": false,
    "sensitiveTopic": false,
    "categoryIds": [
      "cat_calm",
      "cat_resilience"
    ],
    "tags": [
      "anxiety",
      "grounding"
    ],
    "contraindications": [],
    "readingLevel": 6,
    "isPremium": false,
    "source": "CURATED",
    "createdAt": "2026-02-17T12:00:00Z",
    "updatedAt": "2026-02-17T12:00:00Z"
  },
  {
    "id": "aff_calm_003",
    "locale": "en-GB",
    "text": "I can return to the present moment, one detail at a time.",
    "tone": "GENTLE",
    "intensity": "LOW",
    "absolute": false,
    "sensitiveTopic": false,
    "categoryIds": [
      "cat_calm"
    ],
    "tags": [
      "mindfulness",
      "grounding"
    ],
    "contraindications": [],
    "readingLevel": 6,
    "isPremium": false,
    "source": "CURATED",
    "createdAt": "2026-02-17T12:00:00Z",
    "updatedAt": "2026-02-17T12:00:00Z"
  },
  {
    "id": "aff_motiv_001",
    "locale": "en-GB",
    "text": "One small step today is still progress.",
    "tone": "NEUTRAL",
    "intensity": "MEDIUM",
    "absolute": false,
    "sensitiveTopic": false,
    "categoryIds": [
      "cat_motivation",
      "cat_focus"
    ],
    "tags": [
      "work",
      "agency"
    ],
    "contraindications": [],
    "readingLevel": 6,
    "isPremium": false,
    "source": "CURATED",
    "createdAt": "2026-02-17T12:00:00Z",
    "updatedAt": "2026-02-17T12:00:00Z"
  },
  {
    "id": "aff_motiv_002",
    "locale": "en-GB",
    "text": "I choose what matters most, and I start there.",
    "tone": "GENTLE",
    "intensity": "LOW",
    "absolute": false,
    "sensitiveTopic": false,
    "categoryIds": [
      "cat_focus",
      "cat_motivation"
    ],
    "tags": [
      "priorities",
      "work"
    ],
    "contraindications": [],
    "readingLevel": 6,
    "isPremium": true,
    "source": "CURATED",
    "createdAt": "2026-02-17T12:00:00Z",
    "updatedAt": "2026-02-17T12:00:00Z"
  },
  {
    "id": "aff_grat_001",
    "locale": "en-GB",
    "text": "Even on hard days, I can notice one small good thing.",
    "tone": "GENTLE",
    "intensity": "MEDIUM",
    "absolute": false,
    "sensitiveTopic": false,
    "categoryIds": [
      "cat_gratitude",
      "cat_resilience"
    ],
    "tags": [
      "gratitude",
      "balance"
    ],
    "contraindications": [],
    "readingLevel": 6,
    "isPremium": false,
    "source": "CURATED",
    "createdAt": "2026-02-17T12:00:00Z",
    "updatedAt": "2026-02-17T12:00:00Z"
  },
  {
    "id": "aff_grat_002",
    "locale": "en-GB",
    "text": "I appreciate the support I have, and I can ask for more.",
    "tone": "GENTLE",
    "intensity": "LOW",
    "absolute": false,
    "sensitiveTopic": false,
    "categoryIds": [
      "cat_gratitude",
      "cat_relationships"
    ],
    "tags": [
      "relationships",
      "gratitude"
    ],
    "contraindications": [],
    "readingLevel": 6,
    "isPremium": true,
    "source": "CURATED",
    "createdAt": "2026-02-17T12:00:00Z",
    "updatedAt": "2026-02-17T12:00:00Z"
  },
  {
    "id": "aff_rel_001",
    "locale": "en-GB",
    "text": "I can be honest and kind at the same time.",
    "tone": "GENTLE",
    "intensity": "LOW",
    "absolute": false,
    "sensitiveTopic": false,
    "categoryIds": [
      "cat_relationships"
    ],
    "tags": [
      "communication",
      "boundaries"
    ],
    "contraindications": [],
    "readingLevel": 6,
    "isPremium": true,
    "source": "CURATED",
    "createdAt": "2026-02-17T12:00:00Z",
    "updatedAt": "2026-02-17T12:00:00Z"
  },
  {
    "id": "aff_bound_001",
    "locale": "en-GB",
    "text": "It is okay to say no without explaining everything.",
    "tone": "GENTLE",
    "intensity": "LOW",
    "absolute": false,
    "sensitiveTopic": false,
    "categoryIds": [
      "cat_boundaries"
    ],
    "tags": [
      "boundaries"
    ],
    "contraindications": [],
    "readingLevel": 6,
    "isPremium": true,
    "source": "CURATED",
    "createdAt": "2026-02-17T12:00:00Z",
    "updatedAt": "2026-02-17T12:00:00Z"
  },
  {
    "id": "aff_sleep_001",
    "locale": "en-GB",
    "text": "I can let today be done.",
    "tone": "GENTLE",
    "intensity": "LOW",
    "absolute": false,
    "sensitiveTopic": false,
    "categoryIds": [
      "cat_sleep"
    ],
    "tags": [
      "sleep",
      "winddown"
    ],
    "contraindications": [],
    "readingLevel": 6,
    "isPremium": true,
    "source": "CURATED",
    "createdAt": "2026-02-17T12:00:00Z",
    "updatedAt": "2026-02-17T12:00:00Z"
  },
  {
    "id": "aff_sleep_002",
    "locale": "en-GB",
    "text": "My body knows how to soften and rest.",
    "tone": "GENTLE",
    "intensity": "LOW",
    "absolute": false,
    "sensitiveTopic": false,
    "categoryIds": [
      "cat_sleep"
    ],
    "tags": [
      "sleep",
      "self_compassion"
    ],
    "contraindications": [],
    "readingLevel": 6,
    "isPremium": true,
    "source": "CURATED",
    "createdAt": "2026-02-17T12:00:00Z",
    "updatedAt": "2026-02-17T12:00:00Z"
  },
  {
    "id": "aff_focus_001",
    "locale": "en-GB",
    "text": "I can focus on one thing, then the next.",
    "tone": "GENTLE",
    "intensity": "LOW",
    "absolute": false,
    "sensitiveTopic": false,
    "categoryIds": [
      "cat_focus"
    ],
    "tags": [
      "work",
      "focus"
    ],
    "contraindications": [],
    "readingLevel": 6,
    "isPremium": true,
    "source": "CURATED",
    "createdAt": "2026-02-17T12:00:00Z",
    "updatedAt": "2026-02-17T12:00:00Z"
  },
  {
    "id": "aff_res_001",
    "locale": "en-GB",
    "text": "I have survived difficult days before.",
    "tone": "GENTLE",
    "intensity": "MEDIUM",
    "absolute": false,
    "sensitiveTopic": false,
    "categoryIds": [
      "cat_resilience"
    ],
    "tags": [
      "resilience"
    ],
    "contraindications": [],
    "readingLevel": 6,
    "isPremium": true,
    "source": "CURATED",
    "createdAt": "2026-02-17T12:00:00Z",
    "updatedAt": "2026-02-17T12:00:00Z"
  },
  {
    "id": "aff_res_002",
    "locale": "en-GB",
    "text": "I can be patient with my pace.",
    "tone": "GENTLE",
    "intensity": "LOW",
    "absolute": false,
    "sensitiveTopic": false,
    "categoryIds": [
      "cat_resilience",